{
  "agent_protocol_version": "1.5.0",
  "device_id": "11111111-1111-4111-8111-111111111111",
  "generation_id": "44444444-4444-4444-8444-444444444444",
  "generation": 1,
  "bundle_fingerprint": "d69f27aaceaa044a23c82d3083306b7378961dd26e2eccd41be44ec83ec061ee",
  "accepted": true,
  "accepted_at": "2026-10-20T00:00:00.000001Z"
}
